{
  "schema_version": "1.0",
  "lock_kind": "offline",
  "evidence": "SYNTHETIC_REHEARSAL",
  "created_at": "2026-09-27T09:00:00+03:00",
  "created_by": "SYNTHETIC schema example (schemas/examples)",
  "git_sha": "0000000000000000000000000000000000000000",
  "git_dirty": true,
  "prereg": {
    "path": "docs/experiments/phase-18-prereg.md",
    "version": 1,
    "sha256": "sha256:0000000000000000000000000000000000000000000000000000000000000000"
  },
  "notes": "SYNTHETIC schema example: every value is illustrative; never evidence",
  "offline": {
    "dataset": {
      "version": "ds-v0.0-selftest-p11-kinematic",
      "kind": "SELFTEST",
      "manifest_sha256": "sha256:1111111111111111111111111111111111111111111111111111111111111111",
      "labels_version": "labels-v1.0 (SYNTHETIC fixture targets)",
      "split_sha256": "sha256:2222222222222222222222222222222222222222222222222222222222222222",
      "test_participants": ["SYNTHETIC-K1", "SYNTHETIC-K4", "SYNTHETIC-K9"],
      "p_test": 3,
      "sessions": [
        {"session_id": "synthetic-p11-kinematic-1", "participant_id": "SYNTHETIC-K1", "lighting_id": null, "distance_mark": null},
        {"session_id": "synthetic-p11-kinematic-4", "participant_id": "SYNTHETIC-K4", "lighting_id": null, "distance_mark": null},
        {"session_id": "synthetic-p11-kinematic-9", "participant_id": "SYNTHETIC-K9", "lighting_id": null, "distance_mark": null}
      ],
      "fixture": {"generator": "scripts/_p11_fixture.kinematic_fixture", "identities": 12, "seconds": 24.0, "seed": 1100}
    },
    "harness": {
      "version": "p09-harness-v1-development",
      "source_sha256": {"src/spacedrums/eval/matching.py": "sha256:3333333333333333333333333333333333333333333333333333333333333333"}
    },
    "sources": {"src/spacedrums/eval/matching.py": "sha256:3333333333333333333333333333333333333333333333333333333333333333"},
    "matching": {
      "rule": "ADR-0023",
      "w_primary_s": 0.05,
      "provenance": {"source": "SYNTHETIC example value", "decided_by": "schema example (not the owner)", "date": "2026-09-27"}
    },
    "delay": {
      "primary_s": {"A": 0.03, "B-CV": 0.03, "C": 0.03},
      "appendix_s": 0,
      "provenance": {"source": "SYNTHETIC example value", "decided_by": "schema example (not the owner)", "date": "2026-09-27"}
    },
    "budgets": {
      "fp_budget_per_min": 30.0,
      "fn_ceiling": 0.6,
      "delta_audio_s": 0.03,
      "delta_te_s": 0.03,
      "delta_lead_s": 0.005,
      "cpu_p95_ms": 50.0,
      "provenance": {"source": "SYNTHETIC example value", "decided_by": "schema example (not the owner)", "date": "2026-09-27"}
    },
    "acoustic": {"status": "NOT_MEASURED", "s_phys_s": null, "source": "docs/reports/phase-07-acoustic-validation.md (not validated)"},
    "arms": [
      {
        "arm_id": "A", "role": "reference", "replay_arm": "A",
        "controls": {"tti_commit_s": 0.05, "p_commit": 0.5, "n_confirm_frames": 0, "v_min": 0.15, "refractory_zone_s": 0.1},
        "rule": null, "model": null,
        "operating_point": {"feasible": true, "selection_path": "experiments/example/selections/A.json",
          "selection_sha256": "sha256:4444444444444444444444444444444444444444444444444444444444444444",
          "validation": {"median_lead_s": -0.04, "fp_per_min": 2.0, "fn_rate": 0.1}}
      },
      {
        "arm_id": "B-CV", "role": "baseline", "replay_arm": "B",
        "controls": {"tti_commit_s": 0.1, "p_commit": 0.3, "n_confirm_frames": 0, "v_min": 0.15, "refractory_zone_s": 0.1},
        "rule": {"motion_model": "CV", "K": 6}, "model": null,
        "operating_point": {"feasible": true, "selection_path": "experiments/example/selections/B-CV.json",
          "selection_sha256": "sha256:5555555555555555555555555555555555555555555555555555555555555555",
          "validation": {"median_lead_s": 0.01, "fp_per_min": 12.0, "fn_rate": 0.3}}
      },
      {
        "arm_id": "C", "role": "primary", "replay_arm": "MODEL:C-GRU",
        "controls": {"tti_commit_s": 0.05, "p_commit": 0.0, "n_confirm_frames": 0, "v_min": 0.15, "refractory_zone_s": 0.1},
        "rule": null,
        "model": {"kind": "temporal", "path": "experiments/example/models/c-gru",
          "manifest_sha256": "sha256:6666666666666666666666666666666666666666666666666666666666666666",
          "export_sha256": "sha256:7777777777777777777777777777777777777777777777777777777777777777",
          "norm_stats_path": "experiments/example/features/fold-0/norm_stats.json",
          "norm_stats_sha256": "sha256:8888888888888888888888888888888888888888888888888888888888888888",
          "fold": 0, "window_n": 8},
        "operating_point": {"feasible": true, "selection_path": "experiments/example/selections/C.json",
          "selection_sha256": "sha256:9999999999999999999999999999999999999999999999999999999999999999",
          "validation": {"median_lead_s": 0.012, "fp_per_min": 18.0, "fn_rate": 0.35}},
        "inference_latency": null
      }
    ],
    "b_primary": "B-CV",
    "c_primary": "C",
    "curves": {"tau_commit_s": [0.02, 0.05, 0.1, 0.15, 0.2], "p_commit": [0.3, 0.5, 0.7]},
    "statistics": {"repeats": 10000, "seed": 18, "level": 0.95}
  }
}
